releve.n	site_ID	plot_ID	subplot_ID	area	author	date	locality	lat	long	acc	aspect	incl	alt	habitat	comment	management	management_detail	degradation	cover_tot	cover_e2	cover_e1	cover_e0	cover_moss	cover_lichen	cover_litter	bare_ground	gravel	rock	height_mean_e2	height_mean_e1	height_max_e1
64_10	ENV36	ENV36_2	ENV36_2A	10	DB, MK	20230530	PP Hovoranske louky	48.96658	16.97547	3	15	13	230	T34		mowing	mowing in the autumn, can be not each year? Last year mowed	3,8	85	0	70	35	35	0	23	2	0	0	0	15	NA
65_10	ENV37	ENV37_1	ENV37_1A	10	DB, MK	20230530	PP Zapoved u Karlina	48.97035	16.96825	3	295	10	254	T34	thick litter, shrubs around, standing dry grass	abandoned	abandoned at least last years, but was mown before	3,7,8	90	0	90	2	2	0	80	0	0	0	0	40	NA
66_10	ENV37	ENV37_2	ENV37_2A	10	DB, MK	20230530	PP Zapoved u Karlina	48.97071	16.96857	3	295	15	256	T34		mowing	regular mowing	1	75	0	65	15	15	0	10	15	0	0	0	15	NA
67_10	ENV38	ENV38_1	ENV38_1A	10	DB	20230603	PP Spidlaky	48.9165	16.96457	5	350	5	256	T34?/T33	area is not regularly managed, there is less litter on steep slopes and more - on gentle slopes, standing dry grasses (Bromus)	abandoned	abandoned at least last years	3,7,8	50	0	45	5	5	0	85	1	0	0	0	35	NA
68_10	ENV38	ENV38_2	ENV38_2A	10	DB	20230603	PP Spidlaky	48.92309	16.95621	3	345	7	226	T34?/T33		mowing	regular mowing	1	90	0	80	35	35	0	10	5	0	0	0	20	NA
69_10	ENV39	ENV39_1	ENV39_1A	10	DB	20230602	PP Predni kopaniny	48.95481	16.74111	3	250	15	284	T34	around shrubs, near planted Robinia trees	abandoned	not managed	3,6,7,8,9	80	1	75	10	10	0	65	2	0	0	60	80	NA
70_10	ENV39	ENV39_2	ENV39_2A	10	DB	20230602	PP Predni kopaniny	48.95498	16.74068	3	250	15	284	T34	very low juv. shrubs	mowing	regular mowing	1	85	0	70	35	35	0	5	10	0	0	0	20	NA
71_10	ENV40	ENV40_1	ENV40_1A	10	DB	20230613	PP Jeslicky	48.94285	16.83924	3	140	15	243	T34	other slopes are steep (loess steppe with S. pulcherrima)	mowing?	management unclear, probably regular mown?		95	0	90	15	15	0	10	1	0	0	0	35	NA
72_10	ENV41	ENV41_1	ENV41_1A	10	DB	20230613	PR Nosperk	48.94255	16.84307	4	175	15	264	T34?	thick litter, shrubs were cut before	abandoned	abandoned at least last years	3,6,7,8,9	70	5	65	1	1	0	90	3	0	0	50	50	NA
73_10	ENV42	ENV42_1	ENV42_1A	10	DB	20230526	PR Sevy	49.13598	16.97285	4	25	25	248	T34 -> Arrhenatherum	thick litter, but shrubs were cut before	abandoned/mosaic?	abandoned at least last year	3,6,7,8	85	1	80	10	10	0	70	1	0	0	60	55	NA
74_10	ENV42	ENV42_2	ENV42_2A	10	DB	20230526	PR Sevy	49.13588	16.97294	3	110	23	242	T34		mowing	regular mowing?	1	85	0	75	15	15	0	10	5	0	0	0	15	NA
75_10	ENV43	ENV43_1	ENV43_1A	10	DB	20230527	PP Clupy	49.14725	16.9473	3	280	30	245	T34	thick litter, high shrubs, soil erosion (steep slope)	abandoned	not mown	3,6,7,8	75	5	65	10	10	0	40	10	0	0	70	35	NA
76_10	ENV44	ENV44_1	ENV44_1A	10	DB	20230523	PP Navdavky u Nemcan	49.15589	16.92186	4	345	23	257	T34	not much litter, low juv shrubs	mowing	regular mowing	1	85	0	75	20	20	0	10	5	0	0	0	25	NA
77_10	ENV44	ENV44_2	ENV44_2A	10	DB	20230526	PP Navdavky u Nemcan	49.15564	16.92205	3	325	17	269	T34/shrub	area around - shrubs/trees	abandoned	abandoned at least last years	3,6,7,8,9	65	15	55	3	3	0	80	2	0	0	130	35	NA
78_10	ENV45	ENV45_1	ENV45_1A	10	DB	20230523	PP Stepni stran u Komoran	49.19594	16.92559	3	260	15	296	T34	not much litter, low and rare juv shrubs in plot, bigger shrubs around	mowing	can be mosaic mowing?	1	98	0	95	7	7	0	5	1	0	0	0	20	NA
79_10	ENV45	ENV45_2	ENV45_2A	10	DB	20230523	PP Stepni stran u Komoran	49.19723	16.92533	3	265	15	288	T34	thick litter, shrubs around	abandoned	mown before?	3,6,7,8	75	0	73	3	3	0	60	1	0	0	0	30	NA
80_10	ENV46	ENV46_1	ENV46_1A	10	DB	20230528	NPP Vetrniky	49.19759	16.97927	3	145	13	361	T33/T34 -> shrub	thick litter, shrubs	abandoned	abandoned last years	3,6,7,8,9	60	15	50	1	1	0	85	0	0	0	60	35	NA
81_10	ENV46	ENV46_2	ENV46_2A	10	DB	20230528	NPP Vetrniky	49.19721	16.97802	3	145	15	359	T33/T34	litter average	mowing	mowing and shrub cleaning, but can be not regular?	8	80	0	70	20	20	0	25	2	0	0	0	28	NA
82_10	ENV47	ENV47_1	ENV47_1A	10	DB	20230527	PR Hasky	49.15865	17.04797	3	125	15	316	T34	thick litter, shrubs	abandoned	not mown just last year(s)	3,6,7,8	45	2	35	10	10	0	85	1	0	0	50	25	NA
83_10	ENV47	ENV47_2	ENV47_2A	10	DB	20230527	PR Hasky	49.15854	17.04845	3	125	15	308	T34	close to 1 but mown, soil erosion	mowing	mowing regular?		80	0	65	25	25	0	5	15	0	0	0	18	NA
84_10	ENV48	ENV48_1	ENV48_1A	10	DB	20230527	PP Roviny	49.15402	17.05435	3	295	20	288	T34/shrub	a lot of litter, area around overgrown by shrubs, but was mown before - branches of shrubs were many times cut	abandoned	not mown last years, but mown before	3,6,7,8	65	10	55	10	10	0	70	1	0	0	60	25	NA
85_10	ENV48	ENV48_2	ENV48_2A	10	DB	20230527	PP Roviny	49.15362	17.05307	3	315	20	282	T34	not much litter	mowing	mosaic mowing? Or mowing not each year	3,8	85	0	70	60	60	0	20	1	0	0	0	20	NA
86_10	ENV49	ENV49_1	ENV49_1A	10	DB	20230525	NPP Malhotky	49.14854	17.05683	3	150	15	268	T34	shrubs are very low (10 cm), regularly cut, no standing dry grass	mowing	regular mowing	1	95	0	75	25	25	0	5	2	0	0	0	15	NA
87_10	ENV49	ENV49_2	ENV49_2A	10	DB	20230525	NPP Malhotky	49.14816	17.05371	3	150	17	274	T34/degradated	shrubs are low, but a lot of litter and Arrhenatherum	abandoned	abandoned at least last years, but was mown before	3,6,7,8	60	0	60	3	3	0	75	0	0	0	0	30	NA
88_10	ENV50	ENV50_1	ENV50_1A	10	DB	20230525	PP Baracka	49.12868	17.01921	4	300	16	248	T34	litter accumulation average	mowing	not each year mown, but last year mown	3,8	90	0	85	20	20	0	25	1	0	0	0	37	NA
89_10	ENV50	ENV50_2	ENV50_2A	10	DB	20230525	PP Baracka	49.12921	17.01893	3	260	17	247	T34/shrub	shrubs were cut before, but now become higher, litter accumulation	abandoned	not mown last years, but mown before	3,6,7,8	75	20	60	5	5	0	70	0	0	0	65	45	NA
90_10	ENV51	ENV51_1	ENV51_1A	10	DB	20230524	PP Prehon	49.17056	17.23628	4	125	15	319	T34	thick litter, everything around overgrown by shrubs, standing dry grass	abandoned	abandoned last years	3,6,7,8	55	10	45	5	5	0	85	1	0	0	110	35	NA
91_10	ENV51	ENV51_2	ENV51_2A	10	DB	20230524	PP Prehon	49.17082	17.2355	3	125	15	332	T34	shrubs juv. are very low, no signs of grazing, herb layer low	mowing	regular mowing	1	90	0	80	30	30	0	5	5	0	0	0	15	NA
92_10	ENV52	ENV52_1	ENV52_1A	10	DB	20230524	NPR Strabisov-Oulehla	49.17143	17.21041	3	160	13	314	T34/shrub	very thick litter, overgrowing by shrubs (but shrubs were cut before), few orchids not flowering, standing dry grass, Calamagrostis and Arrhenatherum expansion	abandoned	abandoned at least last years	3,6,7,8	75	15	60	5	5	0	85	0.5	0	0	60	35	NA
93_10	ENV52	ENV52_2	ENV52_2A	10	DB	20230524	NPR Strabisov-Oulehla	49.17061	17.21101	3	160	15	300	T34	juv shrubs are very low, almost no litter	mowing	regular mowing	1	95	0	80	30	30	0	10	2	0	0	0	15	NA
94_10	ENV53	ENV53_1	ENV53_1A	10	DB	20230524	PP Kuce	49.15391	17.15972	3	30	15	310	T34	most of site - more mesic vegetation	mowing	regular or not?	3,6,7	80	0	70	40	40	0	7	10	0	0	0	25	NA
